{
  "schema_version": "2.0",
  "schema_url": "https://dmtcode.com/timeline.schema.json",
  "provenance": {
    "verified_on": "2026-07-29",
    "verified_against": "Crossref DOI resolution, US Supreme Court opinion record, and this site's own database",
    "rule": "Every entry carries an evidence_class. Nothing is listed as published research unless its DOI resolves to the work described. Claims with no source are labelled community_report and are not presented as evidence."
  },
  "title": {
    "headline": "A chronology of research into DMT visual phenomena",
    "text": "From Klüver's form constants in 1926 to the 650 nm laser protocol, a dated record of what has been published, what has been observed, and what is still only claimed. Sort it by date, by person, by place, or by kind of evidence. The question this chronology cannot yet answer is how many people run the protocol and see nothing, because nobody has counted. That is why null reports are collected here."
  },
  "evidence_classes": {
    "peer_reviewed": "Published in a peer-reviewed journal. The DOI resolves to the work described.",
    "book": "Published book. Identified by ISBN. Not peer reviewed.",
    "legal": "Court decision or statute. Identified by citation and official opinion text.",
    "letters": "Published in a letters or news-and-views venue outside mainstream peer review.",
    "journalism": "Reporting by a named publication.",
    "commentary": "Public comment by a named researcher, outside a formal publication.",
    "platform_record": "A record in this site's own database, checkable against the public data export.",
    "community_report": "Community history with no published source. Recorded so the origin is visible. Not evidence."
  },
  "entries": [
    {
      "id": "kluver-1926-form-constants",
      "date": {
        "year": 1926,
        "precision": "year",
        "sort_key": "1926-00-00"
      },
      "headline": "Klüver names the form constants",
      "summary": "Klüver catalogues the recurring geometric categories people report under mescaline. His four form constants, the lattice or honeycomb, the cobweb, the tunnel and the spiral, become the vocabulary every later account of geometric hallucination is measured against.",
      "people": [
        {
          "name": "Heinrich Klüver",
          "sort": "Kluver"
        }
      ],
      "tags": [
        "form-constants",
        "mescaline",
        "phenomenology",
        "visual-geometry"
      ],
      "evidence_class": "peer_reviewed",
      "source": {
        "kind": "journal_article",
        "title": "Mescal Visions and Eidetic Vision",
        "authors": [
          "Klüver, H."
        ],
        "container": "The American Journal of Psychology",
        "volume": "37",
        "pages": "502",
        "year": 1926,
        "doi": "10.2307/1414910",
        "url": "https://doi.org/10.2307/1414910",
        "citation": "Klüver, H. (1926). Mescal Visions and Eidetic Vision. The American Journal of Psychology, 37, 502."
      }
    },
    {
      "id": "szara-1956-first-human-dmt",
      "date": {
        "year": 1956,
        "precision": "year",
        "sort_key": "1956-00-00"
      },
      "headline": "First documented human DMT administration",
      "summary": "Szára administers DMT to human subjects and reports the psychological effects alongside its metabolism. This is the earliest documented human DMT session in the published record.",
      "people": [
        {
          "name": "Stephen Szára",
          "sort": "Szara"
        }
      ],
      "place": {
        "label": "Budapest, Hungary",
        "country": "HU"
      },
      "tags": [
        "dmt",
        "first-human-study",
        "pharmacology",
        "serotonin"
      ],
      "evidence_class": "peer_reviewed",
      "source": {
        "kind": "journal_article",
        "title": "Dimethyltryptamin: Its metabolism in man; the relation of its psychotic effect to the serotonin metabolism",
        "authors": [
          "Szára, S."
        ],
        "container": "Experientia",
        "volume": "12",
        "year": 1956,
        "doi": "10.1007/BF02157378",
        "url": "https://doi.org/10.1007/BF02157378",
        "citation": "Szára, S. (1956). Dimethyltryptamin: Its metabolism in man; the relation of its psychotic effect to the serotonin metabolism. Experientia, 12."
      }
    },
    {
      "id": "christian-1977-endogenous-dmt",
      "date": {
        "year": 1977,
        "precision": "year",
        "sort_key": "1977-00-00"
      },
      "headline": "DMT identified in mammalian brain tissue",
      "summary": "DMT is identified in mammalian brain tissue and proposed as a possible endogenous neuroregulatory agent. Whether the human body produces DMT in quantities that matter behaviourally has been argued over ever since, and is still not settled.",
      "people": [
        {
          "name": "Stephen T. Christian",
          "sort": "Christian"
        },
        {
          "name": "R. Harrison",
          "sort": "Harrison"
        },
        {
          "name": "E. Quayle",
          "sort": "Quayle"
        },
        {
          "name": "J. Pagel",
          "sort": "Pagel"
        },
        {
          "name": "J. Monti",
          "sort": "Monti"
        }
      ],
      "tags": [
        "endogenous-dmt",
        "neurochemistry",
        "open-question"
      ],
      "evidence_class": "peer_reviewed",
      "source": {
        "kind": "journal_article",
        "title": "The in vitro identification of dimethyltryptamine (DMT) in mammalian brain and its characterization as a possible endogenous neuroregulatory agent",
        "authors": [
          "Christian, S.T.",
          "Harrison, R.",
          "Quayle, E.",
          "Pagel, J.",
          "Monti, J."
        ],
        "container": "Biochemical Medicine",
        "volume": "18",
        "year": 1977,
        "doi": "10.1016/0006-2944(77)90088-6",
        "url": "https://doi.org/10.1016/0006-2944(77)90088-6",
        "citation": "Christian, S.T., Harrison, R., Quayle, E., Pagel, J., & Monti, J. (1977). The in vitro identification of dimethyltryptamine (DMT) in mammalian brain and its characterization as a possible endogenous neuroregulatory agent. Biochemical Medicine, 18."
      }
    },
    {
      "id": "ermentrout-cowan-1979-v1-model",
      "date": {
        "year": 1979,
        "precision": "year",
        "sort_key": "1979-00-00"
      },
      "headline": "Geometric hallucination derived from cortical wiring",
      "summary": "Ermentrout and Cowan derive Klüver's form constants from the architecture of primary visual cortex. Stripes and hexagons of cortical activity map, through the retino-cortical transform, onto the tunnels and spirals people describe. This remains the strongest standing argument that geometric hallucination is generated inside the visual system rather than received from outside it.",
      "people": [
        {
          "name": "G. Bard Ermentrout",
          "sort": "Ermentrout"
        },
        {
          "name": "Jack D. Cowan",
          "sort": "Cowan"
        }
      ],
      "place": {
        "label": "Chicago, Illinois, United States",
        "country": "US"
      },
      "tags": [
        "form-constants",
        "visual-cortex",
        "modelling",
        "v1",
        "skeptical-explanation"
      ],
      "evidence_class": "peer_reviewed",
      "source": {
        "kind": "journal_article",
        "title": "A mathematical theory of visual hallucination patterns",
        "authors": [
          "Ermentrout, G.B.",
          "Cowan, J.D."
        ],
        "container": "Biological Cybernetics",
        "volume": "34",
        "year": 1979,
        "doi": "10.1007/BF00336965",
        "url": "https://doi.org/10.1007/BF00336965",
        "citation": "Ermentrout, G.B., & Cowan, J.D. (1979). A mathematical theory of visual hallucination patterns. Biological Cybernetics, 34."
      }
    },
    {
      "id": "strassman-1994-dose-response-i",
      "date": {
        "year": 1994,
        "precision": "year",
        "sort_key": "1994-00-00"
      },
      "headline": "The New Mexico dose-response study",
      "summary": "The first US human DMT research in a generation. Strassman and Qualls establish dose-response relationships for intravenous DMT under clinical conditions, reopening a line of work that had been closed since the 1970s.",
      "people": [
        {
          "name": "Rick Strassman",
          "sort": "Strassman"
        },
        {
          "name": "Clifford Qualls",
          "sort": "Qualls"
        }
      ],
      "place": {
        "label": "Albuquerque, New Mexico, United States",
        "country": "US"
      },
      "tags": [
        "dmt",
        "human-study",
        "dose-response",
        "clinical"
      ],
      "evidence_class": "peer_reviewed",
      "source": {
        "kind": "journal_article",
        "title": "Dose-Response Study of N,N-Dimethyltryptamine in Humans: I. Neuroendocrine, Autonomic, and Cardiovascular Effects",
        "authors": [
          "Strassman, R.J.",
          "Qualls, C.R."
        ],
        "container": "Archives of General Psychiatry",
        "volume": "51",
        "year": 1994,
        "doi": "10.1001/archpsyc.1994.03950020009001",
        "url": "https://doi.org/10.1001/archpsyc.1994.03950020009001",
        "citation": "Strassman, R.J., & Qualls, C.R. (1994). Dose-Response Study of N,N-Dimethyltryptamine in Humans: I. Neuroendocrine, Autonomic, and Cardiovascular Effects. Archives of General Psychiatry, 51."
      }
    },
    {
      "id": "strassman-1994-dose-response-ii",
      "date": {
        "year": 1994,
        "precision": "year",
        "sort_key": "1994-00-01"
      },
      "headline": "A rating scale for the DMT state",